CodigoDiagnostico;Descripcion
A000;COLERA DEBIDO A VIBRIO CHOLERAE O1, BIOTIPO CHOLERAE
A001;COLERA DEBIDO A VIBRIO CHOLERAE O1, BIOTIPO EL TOR
A009;COLERA NO ESPECIFICADO
A010;FIEBRE TIFOIDEA
A011;FIEBRE PARATIFOIDEA A
A012;FIEBRE PARATIFOIDEA B
A013;FIEBRE PARATIFOIDEA C
A014;FIEBRE PARATIFOIDEA, NO ESPECIFICADA
A020;ENTERITIS DEBIDA A SALMONELLA
A021;SEPTICEMIA DEBIDA A SALMONELLA
A022;INFECCIONES LOCALIZADAS DEBIDA A SALMONELLA
A028;OTRAS INFECCIONES ESPECIFICADAS COMO DEBIDAS A SALMONELLA
A029;INFECCIÓN DEBIDA A SALMONELLA NO ESPECIFICADA
A030;SHIGELOSIS DEBIDA A SHIGELLA DYSENTERIAE
A031;SHIGELOSIS DEBIDA A SHIGELLA FLEXNERI
A032;SHIGELOSIS DEBIDA A SHIGELLA BOYDII
A033;SHIGELOSIS DEBIDA A SHIGELLA SONNEI
A038;OTRAS SHIGELOSIS
A039;SHIGELOSIS DE TIPO NO ESPECIFICADO
A040;INFECCION DEBIDA A ESCHERICHIA COLI ENTEROPATOGENA
A041;INFECCION DEBIDA A ESCHERICHIA COLI ENTEROTOXIGENA
A042;INFECCION DEBIDA A ESCHERICHIA COLI ENTEROINVASIVA
A043;INFECCION DEBIDA A ESCHERICHIA COLI ENTEROHEMORRAGICA
A044;OTRAS INFECCIONES INTESTINALES DEBIDAS A ESCHERICHIA COLI
A045;ENTERITIS DEBIDA A CAMPYLOBACTER
A046;ENTERITIS DEBIDA A YERSINIA ENTEROCOLITICA
A047;ENTEROCOLITIS DEBIDA A CLOSTRIDIUM DIFFICILE
A048;OTRAS INFECCIONES INTESTINALES BACTERIANAS ESPECIFICADAS
A049;INFECCION INTESTINAL BACTERIANA, NO ESPECIFICADA
A050;INTOXICACION ALIMENTARIA ESTAFILOCOCICA
A051;BOTULISMO
A052;INTOXICACION ALIMENTARIA DEBIDA A CLOSTRIDIUM PERFRINGENS [CLOSTRIDIUM WELCHII]
A053;INTOXICACION ALIMENTARIA DEBIDA A VIBRIO PARAHAEMOLYTICUS
A054;INTOXICACION ALIMENTARIA DEBIDA A BACILLUS CEREUS
A058;OTRAS INTOXICACIONES ALIMENTARIAS DEBIDAS A BACTERIAS ESPECIFICADAS
A059;INTOXICACION ALIMENTARIA BACTERIANA, NO ESPECIFICADA
A060;DISENTERIA AMEBIANA AGUDA
A061;AMEBIASIS INTESTINAL CRONICA
A062;COLITIS AMEBIANA NO DISENTERICA
A063;AMEBOMA INTESTINAL
A064;ABSCESO AMEBIANO DEL HIGADO
A065†;ABSCESO AMEBIANO DEL PULMON (J99.8*)
A066†;ABSCESO AMEBIANO DEL CEREBRO (G07*)
A067;AMEBIASIS CUTANEA
A068;INFECCION AMEBIANA DE OTRAS LOCALIZACIONES
A069;AMEBIASIS, NO ESPECIFICADA
A070;BALANTIDIASIS
A071;GIARDIASIS [LAMBLIASIS]
A072;CRIPTOSPORIDIOSIS
A073;ISOSPORIASIS
A078;OTRAS ENFERMEDADES INTESTINALES ESPECIFICADAS DEBIDAS A PROTOZOARIOS
A079;ENFERMEDAD INTESTINAL DEBIDA A PROTOZOARIOS, NO ESPECIFICADA
A080;ENTERITIS DEBIDA A ROTAVIRUS
A081;GASTROENTEROPATIA AGUDA DEBIDA AL AGENTE DE NORWALK
A082;ENTERITIS DEBIDA A ADENOVIRUS
A083;OTRAS ENTERITIS VIRALES
A084;INFECCION INTESTINAL VIRAL, SIN OTRA ESPECIFICACION
A085;OTRAS INFECCIONES INTESTINALES ESPECIFICADAS
A09;DIARREA Y GASTROENTERITIS DE PRESUNTO ORIGEN INFECCIOSO
A150;TUBERCULOSIS DEL PULMON, CONFIRMADA POR HALLAZGO MICROSCOPICO DEL BACILO TUBERCULOSO EN ESPUTO, CON O SIN CULTIVO
A151;TUBERCULOSIS DEL PULMON, CONFIRMADA UNICAMENTE POR CULTIVO
A152;TUBERCULOSIS DEL PULMON, CONFIRMADA HISTOLOGICAMENTE
A153;TUBERCULOSIS DEL PULMON , CONFIRMADA POR MEDIOS NO ESPECIFICADOS
A154;TUBERCULOSIS DE GANGLIOS LINFATICOS INTRATORACICOS, CONFIRMADA BACTERIOLOGICA E HISTOLOGICAMENTE
A155;TUBERCULOSIS DE LARINGE, TRAQUEA Y BRONQUIOS, CONFIRMADA BACTERIOLOGICA E HISTOLOGICAMENTE
A156;PLEURESIA TUBERCULOSA, CONFIRMADA BACTERIOLOGICA E HISTOLOGICAMENTE
A157;TUBERCULOSIS RESPIRATORIA PRIMARIA, CONFIRMADA BACTERIOLOGICA E HISTOLOGICAMENTE
A158;OTRAS TUBERCULOSIS RESPIRATORIAS, CONFIRMADAS BACTERIOLOGICA E HISTOLOGICAMENTE
A159;TUBERCULOSIS RESPIRATORIA NO ESPECIFICADA, CONFIRMADA BACTERIOLOGICAMENTE E HISTOLOGICAMENTE
A160;TUBERCULOSIS DEL PULMON, CON EXAMEN BACTERIOLOGICO E HISTOLOGICO NEGATIVOS
A161;TUBERCULOSIS DEL PULMON, SIN EXAMEN BACTERIOLOGICO E HISTOLOGICO
A162;TUBERCULOSIS DE PULMON, SIN MENCION DE CONFIRMACION BACTERIOLOGICA O HISTOLOGICA
A163;TUBERCULOSIS DE GANGLIOS LINFATICOS INTRATORACICOS, SIN MENCION DE CONFIRMACION BACTERIOLOGICA O HISTOLOGICA
A164;TUBERCULOSIS DE LARINGE, TRAQUEA Y BRONQUIOS, SIN MENCION DE CONFIRMACION BACTERIOLOGICA O HISTOLOGICA
A165;PLEURESIA TUBERCULOSA, SIN MENCION DE CONFIRMACION BACTERIOLOGICA E HISTOLOGICA
A167;TUBERCULOSIS RESPIRATORIA PRIMARIA, SIN MENCION DE CONFIRMACION BACTERIOLOGICA E HISTOLOGICA
A168;OTRAS TUBERCULOSIS RESPIRATORIAS, SIN MENCION DE CONFIRMACION
A169;TUBERCULOSIS RESPIRATORIA NO ESPECIFICADA, SIN MENCION DE CONFIRMACION BACTERIOLOGICA O HISTOLOGICA
A170†;MENINGITIS TUBERCULOSA (G01*)
A171†;TUBERCULOMA MENINGEO (G07*)
A178†;OTRAS TUBERCULOSIS DEL SISTEMA NERVIOSO
A179†;TUBERCULOSIS DEL SISTEMA NERVIOSO, NO ESPECIFICADA (G99.8*)
A180†;TUBERCULOSIS DE HUESOS Y ARTICULACIONES
A181;TUBERCULOSIS DEL APARATO GENITOURINARIO
A182;LINFADENOPATIA PERIFERICA TUBERCULOSA
A183;TUBERCULOSIS DE LOS INTESTINOS, EL PERITONEO Y LOS GANGLIOS MESENTERICOS
A184;TUBERCULOSIS DE LA PIEL Y EL TEJIDO SUBCUTANEO
A185;TUBERCULOSIS DEL OJO
A186;TUBERCULOSIS DEL OIDO
A187†;TUBERCULOSIS DE GLANDULAS SUPRARRENALES (E35.1*)
A188;TUBERCULOSIS DE OTROS ORGANOS ESPECIFICADOS
A190;TUBERCULOSIS MILIAR AGUDA DE UN SOLO SITIO ESPECIFICADO
A191;TUBERCULOSIS MILIAR AGUDA DE SITIOS MULTIPLES
A192;TUBERCULOSIS MILIAR AGUDA, NO ESPECIFICADA
A198;OTRAS TUBERCULOSIS MILIARES
A199;TUBERCULOSIS MILIAR, SIN OTRA ESPECIFICACION
A200;PESTE BUBONICA
A201;PESTE CELULOCUTANEA
A202;PESTE NEUMONICA
A203;MENINGITIS POR PESTE
A207;PESTE SEPTICEMICA
A208;OTRAS FORMAS DE PESTE
A209;PESTE, NO ESPECIFICADA
A210;TULAREMIA ULCEROGLANDULAR
A211;TULAREMIA OCULOGLANDULAR
A212;TULAREMIA PULMONAR
A213;TULAREMIA GASTROINTESTINAL
A217;TULAREMIA GENERALIZADA
A218;OTRAS FORMAS DE TULAREMIA
A219;TULAREMIA , NO ESPECIFICADA
A220;CARBUNCO CUTANEO
A221;CARBUNCO PULMONAR
A222;CARBUNCO GASTROINTESTINAL
A227;CARBUNCO SEPTICEMICO
A228;OTRAS FORMAS DE CARBUNCO
A229;CARBUNCO, NO ESPECIFICADO
A230;BRUCELOSIS DEBIDA A BRUCELLA MELITENSIS
A231;BRUCELOSIS DEBIDA A BRUCELLA ABORTUS
A232;BRUCELOSIS DEBIDA A BRUCELLA SUIS
A233;BRUCELOSIS DEBIDA A BRUCELLA CANIS
A238;OTRAS BRUCELOSIS
A239;BRUCELOSIS, NO ESPECIFICADA
A240;MUERMO
A241;MELIOIDOSIS AGUDA Y FULMINANTE
A242;MELIOIDOSIS SUBAGUDA Y CRONICA
A243;OTRAS MELIOIDOSIS
A244;MELIOIDOSIS , NO ESPECIFICADA
A250;ESPIRILOSIS
A251;ESTREPTOBACILOSIS
A259;FIEBRE POR MORDEDURA DE RATA, NO ESPECIFICADA
A260;ERISIPELOIDE CUTANEO
A267;SEPTICEMIA POR ERYSIPELOTHRIX
A268;OTRAS FORMAS DE ERISIPELOIDE
A269;ERISIPELOIDE, NO ESPECIFICADA
A270;LEPTOSPIROSIS ICTEROHEMORRAGICA
A278;OTRAS FORMAS DE LEPTOSPIROSIS
A279;LEPTOSPIROSIS, NO ESPECIFICADA
A280;PASTEURELOSIS
A281;ENFERMEDAD POR RASGUŃO DE GATO
A282;YERSINIOSIS EXTRAINTESTINAL
A288;OTRAS ENFERMEDADES ZOONOTICAS BACTERIANAS ESPECIFICADAS, NO CLASIFICADAS EN OTRA PARTE
A289;ENFERMEDAD ZOONOTICA BACTERIANA, SIN OTRA ESPECIFICACION
A300;LEPRA INDETERMINADA
A301;LEPRA TUBERCULOIDE
A302;LEPRA TUBERCULOIDE LIMITROFE
A303;LEPRA LIMITROFE
A304;LEPRA LEPROMATOSA LIMITROFE
A305;LEPRA LEPROMATOSA
A308;OTRAS FORMAS DE LEPRA
A309;LEPRA, NO ESPECIFICADA
A310;INFECCIONES POR MICOBACTERIAS PULMONARES
A311;INFECCION CUTANEA POR MICOBACTERIAS
A318;OTRAS INFECCIONES POR MICOBACTERIAS
A319;INFECCION POR MICOBACTERIA, NO ESPECIFICADA
A320;LISTERIOSIS CUTANEA
A321†;MENINGITIS Y MENINGOENCEFALITIS LISTERIANA
A327;SEPTICEMIA LISTERIANA
A328;OTRAS FORMAS DE LISTERIOSIS
A329;LISTERIOSIS, NO ESPECIFICADA
A33;TETANOS NEONATAL
A34;TETANOS OBSTETRICO
A35;OTROS TETANOS
A360;DIFTERIA FARINGEA
A361;DIFTERIA NASOFARINGEA
A362;DIFTERIA LARINGEA
A363;DIFTERIA CUTANEA
A368;OTRAS DIFTERIAS
A369;DIFTERIA, NO ESPECIFICADA
A370;TOS FERINA DEBIDA A BORDETELLA PERTUSSIS
A371;TOS FERINA DEBIDA A BORDETELLA PARAPERTUSSIS
A378;TOS FERINA DEBIDA A OTRAS ESPECIES DE BORDETELLA
A379;TOS FERINA, NO ESPECIFICADA
A38;ESCARLATINA
A390†;MENINGITIS MENINGOCOCICA (G01*)
A391†;SINDROME DE WATERHOUSE-FRIDERICHSEN (E35.1*)
A392;MENINGOCOCEMIA AGUDA
A393;MENINGOCOCEMIA CRONICA
A394;MENINGOCOCEMIA, NO ESPECIFICADA
A395†;ENFERMEDAD CARDIACA DEBIDA A MENINGOCOCO
A398;OTRAS INFECCIONES MENINGOCOCICAS
A399;INFECCION MENINGOCOCICA, NO ESPECIFICADA
A400;SEPTICEMIA DEBIDA A ESTREPTOCOCO, GRUPO A
A401;SEPTICEMIA DEBIDA A ESTREPTOCOCO, GRUPO B
A402;SEPTICEMIA DEBIDA A ESTREPTOCOCO, GRUPO D
A403;SEPTICEMIA DEBIDA A STREPTOCOCCUS PNEUMONIAE
A408;OTRAS SEPTICEMIAS ESTREPTOCOCICAS
A409;SEPTICEMIA ESTREPTOCOCICA, NO ESPECIFICADA
A410;SEPTICEMIA DEBIDA STAPHYLOCOCCUS AUREUS
A411;SEPTICEMIA DEBIDA A OTRO ESTAFILOCOCO ESPECIFICADO
A412;SEPTICEMIA DEBIDA A ESTAFILOCOCO NO ESPECIFICADO
A413;SEPTICEMIA DEBIDA A HAEMOPHILUS INFLUENZAE
A414;SEPTICEMIA DEBIDA A ANAEROBIOS
A415;SEPTICEMIA DEBIDA A OTROS ORGANISMOS GRAMNEGATIVOS
A418;OTRAS SEPTICEMIAS ESPECIFICADAS
A419;SEPTICEMIA, NO ESPECIFICADA
A420;ACTINOMICOSIS PULMONAR
A421;ACTINOMICOSIS ABDOMINAL
A422;ACTINOMICOSIS CERVICOFACIAL
A427;SEPTICEMIA ACTINOMICOTICA
A428;OTRAS FORMAS DE ACTINOMICOSIS
A429;ACTINOMICOSIS, SIN OTRA ESPECIFICACION
A430;NOCARDIOSIS PULMONAR
A431;NOCARDIOSIS CUTANEA
A438;OTRAS FORMAS DE NOCARDIOSIS
A439;NORCARDIOSIS , NO ESPECIFICADA
A440;BARTONELOSIS SISTEMICA
A441;BARTONELOSIS CUTANEA Y MUCOCUTANEA
A448;OTRAS FORMAS DE BARTONELOSIS
A449;BARTONELOSIS, NO ESPECIFICADA
A46;ERISIPELA
A480;GANGRENA GASEOSA
A481;ENFERMEDAD DE LOS LEGIONARIOS
A482;ENFERMEDAD DE LOS LEGIONARIOS NO NEUMONICA [FIEBRE DE PONTIAC]
A483;SINDROME DE CHOQUE TOXICO
A484;FIEBRE PURPURICA BRASILEŃA
A488;OTRAS ENFERMEDADES BACTERIANAS ESPECIFICADAS
A490;INFECCION ESTAFILOCOCICA, SIN OTRA ESPECIFICACIÓN
A491;INFECCION ESTREPTOCOCICA, SIN OTRA ESPECIFICACION
A492;INFECCION POR HAEMOPHILUS INFLUENZAE, SIN OTRA ESPECIFICACION
A493;INFECCION POR MICOPLASMA, SIN OTRA ESPECIFICACION
A498;OTRAS INFECCIONES BACTERIANAS DE SITIO NO ESPECIFICADO
A499;INFECCION BACTERIANA, NO ESPECIFICADA
A500;SIFILIS CONGENITA PRECOZ, SINTOMATICA
A501;SIFILIS CONGENITA PRECOZ, LATENTE
A502;SIFILIS CONGENITA PRECOZ SIN OTRA ESPECIFICACIÓN
A503;OCULOPATIA SIFILITICA CONGENITA TARDIA
A504;NEUROSIFILIS CONGENITA TARDIA [NEUROSIFILIS JUVENIL]
A505;OTRAS FORMAS DE SIFILIS CONGENITA TARDIA, SINTOMATICA
A506;SIFILIS CONGENITA TARDIA, LATENTE
A507;SIFILIS CONGENITA TARDIA, SIN OTRA ESPECIFICACION
A509;SIFILIS CONGENITA, SIN OTRA ESPECIFICACIÓN
A510;SIFILIS GENITAL PRIMARIA
A511;SIFILIS PRIMARIA ANAL
A512;SIFILIS PRIMARIA EN OTROS SITIOS
A513;SIFILIS SECUNDARIA DE PIEL Y MEMBRANAS MUCOSAS
A514;OTRAS SIFILIS SECUNDARIAS
A515;SIFILIS PRECOZ, LATENTE
A519;SIFILIS PRECOZ, SIN OTRA ESPECIFICACIÓN
A520†;SIFILIS CARDIOVASCULAR
A521;NEUROSIFILIS SINTOMATICA
A522;NEUROSIFILIS ASINTOMATICA
A523;NEUROSIFILIS NO ESPECIFICADA
A527;OTRAS SIFILIS TARDIAS SINTOMATICAS
A528;SIFILIS TARDIA, LATENTE
A529;SIFILIS TARDIA, NO ESPECIFICADA
A530;SIFILIS LATENTE, NO ESPECIFICADA COMO PRECOZ O TARDIA
A539;SIFILIS, NO ESPECIFICADA
A540;INFECCION GONOCOCICA DEL TRACTO GENITOURINARIO INFERIOR SIN ABSCESO PERIURETRAL O DE GLANDULA ACCESORIA
A541;INFECCION GONOCOCICA DEL TRACTO GENITOURINARIO INFERIOR CON ABSCESO PERIURETRAL Y DE GLANDULAS ACCESORIAS
A542†;PELVIPERITONITIS GONOCOCICA Y OTRAS INFECCIONES GONOCOCICAS GENITOURINARIAS
A543;INFECCION GONOCOCICA DEL OJO
A544†;INFECCION GONOCOCICA DEL SISTEMA OSTEOMUSCULAR
A545;FARINGITIS GONOCOCICA
A546;INFECCION GONOCOCICA DEL ANO Y DEL RECTO
A548;OTRAS INFECCIONES GONOCOCICAS
A549;INFECCION, GONOCOCICA, NO ESPECIFICADA
A55;LINFOGRANULOMA (VENEREO) POR CLAMIDIAS
A560;INFECCION DEL TRACTO GENITOURINARIO INFERIOR DEBIDA A CLAMIDIAS
A561†;INFECCION DEL PELVIPERITONEO Y OTROS ORGANOS GENITOURINARIOS DEBIDA A CLAMIDIAS
A562;INFECCIONES DEL TRACTO GENITOURINARIO DEBIDAS A CLAMIDIAS, SIN OTRA ESPECIFICACION
A563;INFECCION DEL ANO Y DEL RECTO DEBIDA A CLAMIDIAS
A564;INFECCION DE FARINGE DEBIDA A CLAMIDIAS
A568;INFECCION DE TRANSMISIÓN SEXUAL DE OTROS SITIOS DEBIDA A CLAMIDIAS
A57;CHANCRO BLANDO
A58;GRANULOMA INGUINAL
A590;TRICOMONIASIS UROGENITAL
A598;TRICOMONIASIS DE OTROS SITIOS
A599;TRICOMONIASIS, NO ESPECIFICADA
A600;INFECCION DE GENITALES Y TRAYECTO UROGENITAL Y DEBIDA A VIRUS DEL HERPES [HERPES SIMPLE]
A601;INFECCION DE LA PIEL PERIANAL Y RECTO POR VIRUS DEL HERPES SIMPLE
A609;INFECCION ANOGENITAL POR VIRUS DEL HERPES SIMPLE, SIN OTRA ESPECIFICACION
A630;VERRUGAS (VENEREAS) ANOGENITALES
A638;OTRAS ENFERMEDADES DE TRANSMISIÓN PREDOMINANTEMENTE SEXUAL, ESPECIFICADAS
A64;ENFERMEDAD DE TRANSMISION SEXUAL NO ESPECIFICADA
A65;SIFILIS NO VENEREA
A660;LESIONES INICIALES DE FRAMBESIA
A661;LESIONES PAPILOMATOSAS MULTIPLES Y FRAMBESIA CON PASO DE CANGREJO
A662;OTRAS LESIONES PRECOCES DE LA PIEL EN LA FRAMBESIA
A663;HIPERQUERATOSIS DE FRAMBESIA
A664;GOMA Y ULCERAS DE FRAMBESIA
A665;GANGOSA
A666;LESIONES FRAMBESICAS DE LOS HUESOS Y DE LAS ARTICULACIONES
A667;OTRAS MANIFESTACIONES DE FRAMBESIA
A668;FRAMBESIA LATENTE
A669;FRAMBESIA , NO ESPECIFICADA
A670;LESIONES PRIMARIAS DE LA PINTA
A671;LESIONES INTERMEDIAS DE LA PINTA
A672;LESIONES TARDIAS DE LA PINTA
A673;LESIONES MIXTAS DE LA PINTA
A679;PINTA, NO ESPECIFICADA
A680;FIEBRE RECURRENTE TRANSMITIDA POR PIOJOS
A681;FIEBRE RECURRENTE TRANSMITIDA POR GARRAPATAS
A689;FIEBRE RECURRENTE, NO ESPECIFICADA
A690;ESTOMATITIS ULCERATIVA NECROTIZANTE
A691;OTRAS INFECCIONES DE VICENT
A692;ENFERMEDAD DE LYME
A698;OTRAS INFECCIONES ESPECIFICADAS POR ESPIROQUETAS
A699;INFECCION POR ESPIROQUETA, NO ESPECIFICADA
A70;INFECCION DEBIDA A CHLAMYDIA PSITTACI
A710;ESTADO INICIAL DE TRACOMA
A711;ESTADO ACTIVO DE TRACOMA
A719;TRACOMA, NO ESPECIFICADO
A740†;CONJUNTIVITIS POR CLAMIDIAS (H13.1*)
A748;OTRAS ENFERMEDADES POR CLAMIDIAS
A749;INFECCION POR CLAMIDIAS, NO ESPECIFICADA
A750;TIFUS EPIDEMICO DEBIDO A RICKETTSIA PROWAZEKII TRANSMITIDO POR PIOJOS
A751;TIFUS RECRUDESCENTE [ENFERMEDAD DE BRILL]
A752;TIFUS DEBIDO A RICKETTSIA TYPHI
A753;TIFUS DEBIDO A RICKETTSIA TSUTSUGAMUSHI
A759;TIFUS, NO ESPECIFICADO
A770;FIEBRE MACULOSA DEBIDO A RICKETTSIA RICKETTSII
A771;FIEBRE MACULOSA DEBIDO A RICKETTSIA CONORII
A772;FIEBRE MACULOSA DEBIDO A RICKETTSIA SIBERICA
A773;FIEBRE MACULOSA DEBIDO A RICKETTSIA AUSTRALIS
A778;OTRAS FIEBRES MACULOSAS
A779;FIEBRE MACULOSA, NO ESPECIFICADA
A78;FIEBRE Q
A790;FIEBRE DE LAS TRINCHERAS
A791;RICKETTSIOSIS PUSTULOSA DEBIDA A RICKETTSIA AKARI
A798;OTRAS RICKETTSIOSIS ESPECIFICADAS
A799;RICKETTSIOSIS, NO ESPECIFICADA
A800;POLIOMIELITIS AGUDA PARALITICA, ASOCIADA A VACUNA
A801;POLIOMIELITIS AGUDA PARALITICA DEBIDA A VIRUS SALVAJE IMPORTADO
A802;POLIOMIELITIS AGUDA PARALITICA DEBIDA A VIRUS SALVAJE AUTOCTONO
A803;OTRAS POLIOMIELITIS AGUDAS PARALITICAS, Y NO LAS ESPECIFICADAS
A804;POLIOMIELITIS AGUDA NO PARALITICA
A809;POLIOMIELITIS AGUDA, SIN OTRA ESPECIFICACIÓN
A810;ENFERMEDAD DE CREUTZFELDT-JAKOB
A811;PANENCEFALITIS ESCLEROSANTE SUBAGUDA
A812;LEUCOENCEFALOPATIA MULTIFOCAL PROGRESIVA
A818;OTRAS INFECCIONES DEL SISTEMA NERVIOSO POR VIRUS ATIPICO
A819;INFECCIONES DEL SISTEMA NERVIOSO CENTRAL POR VIRUS ATIPICO, SIN OTRA ESPECIFICACION
A820;RABIA SELVATICA
A821;RABIA URBANA
A829;RABIA, SIN OTRA ESPECIFICACION
A830;ENCEFALITIS JAPONESA
A831;ENCEFALITIS EQUINA DEL OESTE
A832;ENCEFALITIS EQUINA DEL ESTE
A833;ENCEFALITIS DE SAN LUIS
A834;ENCEFALITIS AUSTRALIANA
A835;ENCEFALITIS DE CALIFORNIA
A836;ENFERMEDAD POR VIRUS ROCIO
A838;OTRAS ENCEFALITIS VIRALES TRANSMITIDAS POR MOSQUITOS
A839;ENCEFALITIS VIRAL TRANSMITIDA POR MOSQUITOS, SIN OTRA ESPECIFICACION
A840;ENCEFALITIS DEL LEJANO ORIENTE TRANSMITIDA POR GARRAPATAS [ENCEFALITIS PRIMAVEROESTIVAL RUSA]
A841;ENCEFALITIS CENTROEUROPEA TRANSMITIDA POR GARRAPATAS
A848;OTRAS ENCEFALITIS VIRALES TRANSMITIDAS POR GARRAPATAS
A849;ENCEFALITIS VIRAL TRANSMITIDA POR GARRAPATAS, SIN OTRA ESPECIFICACION
A850†;ENCEFALITIS ENTEROVIRAL (G05.1*)
A851†;ENCEFALITIS POR ADENOVIRUS (G05.1*)
A852;ENCEFALITIS VIRAL TRANSMITIDA POR ARTROPODOS, SIN OTRA ESPECIFICACIÓN
A858;OTRAS ENCEFALITIS VIRALES ESPECIFICADAS
A86;ENCEFALITIS VIRAL, NO ESPECIFICADA
A870†;MENINGITIS ENTEROVIRAL (G02.0*)
A871†;MENINGITIS DEBIDA A ADENOVIRUS (G02.0*)
A872;CORIOMENINGITIS LINFOCITICA
A878;OTRAS MENINGITIS VIRALES
A879;MENINGITIS VIRAL, SIN OTRA ESPECIFICACION
A880;FIEBRE EXANTEMATICA ENTEROVIRAL [EXANTEMA DE BOSTON]
A881;VERTIGO EPIDEMICO
A888;OTRAS INFECCIONES VIRALES ESPECIFICADAS DEL SISTEMA NERVIOSO CENTRAL
A89;INFECCION VIRAL DEL SISTEMA NERVIOSO CENTRAL, NO ESPECIFICADA
A90;FIEBRE DEL DENGUE [DENGUE CLASICO]
A91;FIEBRE DEL DENGUE HEMORRAGICO
A920;ENFERMEDAD POR VIRUS CHIKUNGUNYA
A921;FIEBRE DE O´NYONG-NYONG
A922;FIEBRE EQUINA VENEZOLANA
A923;FIEBRE DEL OESTE DEL NILO
A924;FIEBRE DEL VALLE DEL RIFT
A928;OTRAS FIEBRES VIRALES ESPECIFICADAS TRANSMITIDAS POR MOSQUITOS
A929;FIEBRE VIRAL TRANSMITIDA POR MOSQUITO, SIN OTRA ESPECIFICACION
A930;ENFERMEDAD POR VIRUS DE OROPOUCHE
A931;FIEBRE TRANSMITIDA POR FLEBOTOMOS
A932;FIEBRE DE COLORADO TRANSMITIDA POR GARRAPATAS
A938;OTRAS FIEBRES VIRALES ESPECIFICADAS TRANSMITIDAS POR ANTROPODOS
A94;FIEBRE VIRAL TRANSMITIDA POR ARTROPODOS, NO ESPECIFICADA
A950;FIEBRE AMARILLA SELVATICA
A951;FIEBRE AMARILLA URBANA
A959;FIEBRE AMARILLA, NO ESPECIFICADA
A960;FIEBRE HEMORRAGICA DE JUNIN
A961;FIEBRE HEMORRAGICA DE MACHUPO
A962;FIEBRE DE LASSA
A968;OTRAS FIEBRES HEMORRAGICAS POR ARENAVIRUS
A969;FIEBRE HEMORRAGICA POR ARENAVIRUS, SIN OTRA ESPECIFICACION
A980;FIEBRE HEMORRAGICA DE CRIMEA-CONGO
A981;FIEBRE HEMORRAGICA DE OMSK
A982;ENFERMEDAD DE LA SELVA DE KYASANUR
A983;ENFERMEDAD POR EL VIRUS DE MARBURG
A984;ENFERMEDAD POR EL VIRUS DE EBOLA
A985;FIEBRES HEMORRAGICAS CON SINDROME RENAL
A988;OTRAS FIEBRES HEMORRAGICAS VIRALES ESPECIFICADAS
A99;FIEBRE VIRAL HEMORRAGICA, NO ESPECIFICADA
B000;ECZEMA HERPETICO
B001;DERMATITIS VESICULAR HERPETICA
B002;GINGIVOESTOMATITIS Y FARINGOAMIGDALITIS HERPETICA
B003†;MENINGITIS HERPETICA (G02.0*)
B004†;ENCEFALITIS HERPETICA (G05.1*)
B005;OCULOPATIA HERPETICA
B007;ENFERMEDAD HERPETICA DISEMINADA
B008;OTRAS FORMAS DE INFECCIONES HERPETICAS
B009;INFECCION DEBIDA A EL VIRUS DEL HERPES, NO ESPECIFICADA
B010†;MENINGITIS DEBIDA A LA VARICELA (G02.0*)
B011†;ENCEFALITIS DEBIDA A LA VARICELA (G05.1*)
B012†;NEUMONIA DEBIDA A LA VARICELA (J17.1*)
B018;VARICELA CON OTRAS COMPLICACIONES
B019;VARICELA SIN COMPLICACIONES
B020†;ENCEFALITIS DEBIDA A HERPES ZOSTER (G05.1*)
B021†;MENINGITIS DEBIDA A HERPES ZOSTER (G02.0*)
B022†;HERPES ZOSTER CON OTROS COMPROMISOS DEL SISTEMA NERVIOSO
B023;HERPES ZOSTER OCULAR
B027;HERPES ZOSTER DISEMINADO
B028;HERPES ZOSTER CON OTRAS COMPLICACIONES
B029;HERPES ZOSTER SIN COMPLICACIONES
B03;VIRUELA
B04;VIRUELA DE LOS MONOS
B050†;SARAMPION COMPLICADO CON ENCEFALITIS (G05.1*)
B051†;SARAMPION COMPLICADO CON MENINGITIS (G02.0*)
B052†;SARAMPION COMPLICADO CON NEUMONIA (J17.1*)
B053†;SARAMPION COMPLICADO CON OTITIS MEDIA (H67.1*)
B054;SARAMPION CON COMPLICACIONES INTESTINALES
B058;SARAMPION CON OTRAS COMPLICACIONES
B059;SARAMPION SIN COMPLICACIONES
B060†;RUBEOLA CON COMPLICACIONES NEUROLOGICAS
B068;RUBEOLA CON OTRAS COMPLICACIONES
B069;RUBEOLA SIN COMPLICACIONES
B07;VERRUGAS VIRICAS
B080;OTRAS INFECCIONES DEBIDAS A ORTOPOXVIRUS
B081;MOLUSCO CONTAGIOSO
B082;EXANTEMA SUBITO [SEXTA ENFERMEDAD]
B083;ERITEMA INFECCIOSO [QUINTA ENFERMEDAD]
B084;ESTOMATITIS VESICULAR ENTEROVIRAL CON EXANTEMA
B085;FARINGITIS VESICULAR ENTEROVIRICA
B088;OTRAS INFECCIONES VIRALES ESPECIFICADAS, CARACTERIZADAS POR LESIONES DE LA PIEL Y DE LAS MEMBRANAS MUCOSAS
B09;INFECCION VIRAL NO ESPECIFICADA, CARACTERIZADA POR LESIONES DE LA PIEL Y DE LAS MEMBRANAS MUCOSAS
B150;HEPATITIS AGUDA TIPO A, SIN COMA HEPATICO
B159;HEPATITIS AGUDA TIPO A, CON COMA HEPATICO
B160;HEPATITIS AGUDA TIPO B, CON AGENTE DELTA (COINFECCION). CON COMA HEPATICO
B161;HEPATITIS AGUDA TIPO B, CON AGENTE DELTA (COINFECCION), SIN COMA HEPATICO
B162;HEPATITIS AGUDA TIPO B, SIN AGENTE DELTA, CON COMA HEPATICO
B169;HEPATITIS AGUDA TIPO B, SIN AGENTE DELTA Y SIN COMA HEPATICO
B170;INFECCION (SUPERINFECCION) AGUDA POR AGENTE DELTA EN EL PORTADOR DE HEPATITIS B
B171;HEPATITIS AGUDA TIPO C
B172;HEPATITIS AGUDA TIPO E
B178;OTRAS HEPATITIS VIRALES AGUDAS ESPECIFICADAS
B180;HEPATITIS VIRAL TIPO B CRONICA, CON AGENTE DELTA
B181;HEPATITIS VIRAL TIPO B CRONICA, SIN AGENTE DELTA
B182;HEPATITIS VIRAL TIPO C CRONICA
B188;OTRAS HEPATITIS VIRALES CRONICAS
B189;HEPATITIS VIRAL CRONICA, SIN OTRA ESPECIFICACION
B190;HEPATITIS VIRAL NO ESPECIFICADA CON COMA
B199;HEPATITIS VIRAL NO ESPECIFICADA SIN COMA
B200;ENFERMEDAD POR EL VIH, RESULTANTE EN INFECCION POR MICOBACTERIAS
B201;ENFERMEDAD POR EL VIH, RESULTANTE EN OTRAS INFECCIONES BACTERIANAS
B202;ENFERMEDAD POR VIH, RESULTANTE EN ENFERMEDAD POR CITOMEGALOVIRUS
B203;ENFERMEDAD POR VIH, RESULTANTE EN OTRAS INFECCIONES VIRALES
B204;ENFERMEDAD POR VIH, RESULTANTE EN CANDIDIASIS
B205;ENFERMEDAD POR VIH, RESULTANTE EN OTRAS MICOSIS
B206;ENFERMEDAD POR VIH, RESULTANTE EN NEUMONIA POR PNEUMOCYSTIS CARINII
B207;ENFERMEDAD POR VIH, RESULTANTE EN INFECCIONES MULTIPLES
B208;ENFERMEDAD POR VIH, RESULTANTE EN OTRAS ENFERMEDADES INFECCIOSAS O PARASITARIAS
B209;ENFERMEDAD POR VIH, RESULTANTE EN ENFERMEDAD INFECCIOSA O PARASITARIA NO ESPECIFICADA
B210;ENFERMEDAD POR VIH, RESULTANTE EN SARCOMA DE KAPOSI
B211;ENFERMEDAD POR VIH, RESULTANTE EN LINFOMA DE BURKITT
B212;ENFERMEDAD POR VIH, RESULTANTE EN OTROS TIPOS DE LINFOMA NO HODGKIN
B213;ENFERMEDAD POR VIH, RESULTANTE EN OTROS TUMORES MALIGNOS DEL TEJIDO LINFOIDE, HEMATOPOYETICO Y TEJIDOS RELACIONADOS
B217;ENFERMEDAD POR VIH, RESULTANTE EN TUMORES MALIGNOS MULTIPLES
B218;ENFERMEDAD POR VIH, RESULTANTE EN OTROS TUMORES MALIGNOS
B219;ENFERMEDAD POR VIH, RESULTANTE EN TUMORES MALIGNOS NO ESPECIFICADOS
B220;ENFERMEDAD POR VIH, RESULTANTE EN ENCEFALOPATIA
B221;ENFERMEDAD POR VIH, RESULTANTE EN NEUMONITIS LINFOIDE INTERSTICIAL
B222;ENFERMEDAD POR VIH, RESULTANTE EN SINDROME CAQUECTICO
B227;ENFERMEDAD POR VIH, RESULTANTE EN ENFERMEDADES MULTIPLES CLASIFICADAS EN OTRA PARTE
B230;SINDROME DE INFECCION AGUDA DEBIDA A VIH
B231;ENFERMEDAD POR VIH, RESULTANTE EN LINFADENOPATIA GENERALIZADA (PERSISTENTE)
B232;ENFERMEDAD POR VIH, RESULTANTE EN ANORMALIDADES INMUNOLOGICAS Y HEMATOLOGICAS, NO CLASIFICADAS EN OTRA PARTE
B238;ENFERMEDAD POR VIH, RESULTANTE EN OTRAS AFECCIONES ESPECIFICADAS
B24;ENFERMEDAD POR VIRUS DE LA INMUNODEFICIENCIA HUMANA (VIH), SIN OTRA ESPECIFICACION
B250†;NEUMONITIS DEBIDA A VIRUS CITOMEGALICO (J17.1*)
B251†;HEPATITIS DEBIDA A VIRUS CITOMEGALICO
B252†;PANCREATITIS DEBIDA A VIRUS CITOMEGALICO
B258;OTRAS ENFERMEDADES DEBIDAS A VIRUS CITOMEGALICO
B259;ENFERMEDAD POR VIRUS CITOMEGALICO, NO ESPECIFICADA
B260†;ORQUITIS POR PAROTIDITIS (N51.1*)
B261†;MENINGITIS POR PAROTIDITIS (G02.0*)
B262†;ENCEFALITIS POR PAROTIDITIS (G05.1*)
B263†;PANCREATITIS POR PAROTIDITIS (K87.1*)
B268;PAROTIDITIS INFECCIOSA CON OTRAS COMPLICACIONES
B269;PAROTIDITIS, SIN COMPLICACIONES
B270;MONONUCLEOSIS DEBIDA A HERPES VIRUS GAMMA
B271;MONONUCLEOSIS POR CITOMEGALOVIRUS
B278;OTRAS MONONUCLEOSIS INFECCIOSAS
B279;MONONUCLEOSIS INFECCIOSA, NO ESPECIFICADA
B300†;QUERATOCONJUNTIVITIS DEBIDA A ADENOVIRUS (H19.2*)
B301†;CONJUNTIVITIS DEBIDA A ADENOVIRUS (H13.1*)
B302;FARINGOCONJUNTIVITIS VIRAL
B303†;CONJUNTIVITIS EPIDEMICA AGUDA HEMORRAGICA (ENTEROVIRICA) (H13.1*)
B308†;OTRAS CONJUNTIVITIS VIRALES (H13.1*)
B309;CONJUNTIVITIS VIRAL, SIN OTRA ESPECIFICACION
B330;MIALGIA EPIDEMICA
B331;ENFERMEDAD DEL RIO ROSS
B332;CARDITIS VIRAL
B333;INFECCIONES DEBIDAS A RETROVIRUS, NO CLASIFICADAS EN OTRA PARTE
B338;OTRAS ENFERMEDADES VIRALES ESPECIFICADAS
B340;INFECCION DEBIDA A ADENOVIRUS, SIN OTRA ESPECIFICACION
B341;INFECCION DEBIDA A ENTEROVIRUS, SIN OTRA ESPECIFICACION
B342;INFECCION DEBIDA A CORONAVIRUS, SIN OTRA ESPECIFICACION
B343;INFECCION DEBIDA A PARVOVIRUS, SIN OTRA ESPECIFICACION
B344;INFECCION DEBIDA A PAPOVAVIRUS, SIN OTRA ESPECIFICACION
B348;OTRAS INFECCIONES VIRALES DE SITIO NO ESPECIFICADO
B349;INFECCION VIRAL, NO ESPECIFICADA
B350;TIŃA DE LA BARBA Y DEL CUERO CABELLUDO
B351;TIŃA DE LAS UŃAS
B352;TIŃA DE LA MANO
B353;TIŃA DEL PIE [TINEA PEDIS]
B354;TIŃA DEL CUERPO [TINEA CORPORIS]
B355;TIŃA IMBRICADA [TINEA IMBRICATA]
B356;TIŃA INGUINAL [TINEA CRURIS]
B358;OTRAS DERMATOFITOSIS
B359;DERMATOFITOSIS, NO ESPECIFICADA
B360;PITIRIASIS VERSICOLOR
B361;TIŃA NEGRA
B362;PIEDRA BLANCA
B363;PIEDRA NEGRA
B368;OTRAS MICOSIS SUPERFICIALES ESPECIFICADAS
B369;MICOSIS SUPERFICIAL, SIN OTRA ESPECIFICACION
B370;ESTOMATITIS CANDIDIASICA
B371;CANDIDIASIS PULMONAR
B372;CANDIDIASIS DE LA PIEL Y DE LAS UŃAS
B373†;CANDIDIASIS DE LA VULVA Y DE LA VAGINA (N77.1*)
B374;CANDIDIASIS DE OTRAS LOCALIZACIONES UROGENITALES
B375†;MENINGITIS DEBIDA A CANDIDA (G02.1*)
B376†;ENDOCARDITIS DEBIDA A CANDIDA (I39.8*)
B377;SEPTICEMIA DEBIDA A CANDIDA
B378;CANDIDIASIS DE OTROS SITIOS
B379;CANDIDIASIS, NO ESPECIFICADA
B380;COCCIDIOIDOMICOSIS PULMONAR AGUDA
B381;COCCIDIOIDOMICOSIS PULMONAR CRONICA
B382;COCCIDIOIDOMICOSIS PULMONAR, SIN OTRA ESPECIFICACION
B383;COCCIDIOIDOMICOSIS CUTANEA
B384†;MENINGITIS DEBIDA A COCCIDIOIDOMICOSIS (G02.1*)
B387;COCCIDIOIDOMICOSIS DISEMINADA
B388;OTRAS FORMAS DE COCCIDIOIDOMICOSIS
B389;COCCIDIOIDOMICOSIS, NO ESPECIFICADA
B390;INFECCION PULMONAR AGUDA DEBIDA A HISTOPLASMA CAPSULATUM
B391;INFECCION PULMONAR CRONICA DEBIDA A HISTOPLASMA CAPSULATUM
B392;INFECCION PULMONAR DEBIDA A HISTOPLASMA CAPSULATUM, SIN OTRA ESPECIFICACION
B393;INFECCION DISEMINADA DEBIDA A HISTOPLASMA CAPSULATUM
B394;HISTOPLASMOSIS DEBIDA A HISTOPLASMA CAPSULATUM, SIN OTRA ESPECIFICACION
B395;INFECCION DEBIDA A HISTOPLASMA DUBOISII
B399;HISTOPLASMOSIS, NO ESPECIFICADA
B400;BLASTOMICOSIS PULMONAR AGUDA
B401;BLASTOMICOSIS PULMONAR CRONICA
B402;BLASTOMICOSIS PULMONAR, SIN OTRA ESPECIFICACION
B403;BLASTOMICOSIS CUTANEA
B407;BLASTOMICOSIS DISEMINADA
B408;OTRAS FORMAS DE BLASTOMICOSIS
B409;BLASTOMICOSIS, NO ESPECIFICADA
